{
  "dataset_class": "PUBLIC_KB",
  "synthetic": false,
  "observation_id": "obs:kb-seller-loan:bfb9f700adf85398bf41bb7c87e758bb",
  "collection_attempt_id": "collect:kb-seller-loan:dabfba05a5505912aaad2e1975cc189c",
  "collection_run_id": "run:c85c3aa2b2525055bb330533a7285ba8",
  "product_key": "kb-seller-loan",
  "source_url": "https://zloan.kbstar.com/quics?page=C108424",
  "final_url": null,
  "observed_at": "2026-09-21T05:11:37Z",
  "acquisition_method": "HTTP_DOWNLOAD",
  "snapshot_manifest_path": "datasets/public/kb/manifests/2026-09-21/kb-seller-loan.manifest.json",
  "snapshot_hash": "sha256:def6b5b670fc0adf36909ffd1ce47bd416a67e213f7127b5058c44681fe7e44b"
}
