{
  "dataset_class": "PUBLIC_KB",
  "synthetic": false,
  "observation_id": "obs:boss-plus-overdraft:1b5623e2dfd35a6e9088dfb83d4a477d",
  "collection_attempt_id": "collect:boss-plus-overdraft:e01815c5f5f55ae7b0b2fcfbf95a721f",
  "collection_run_id": "run:c85c3aa2b2525055bb330533a7285ba8",
  "product_key": "boss-plus-overdraft",
  "source_url": "https://zloan.kbstar.com/quics?page=C110940",
  "final_url": null,
  "observed_at": "2026-09-21T05:11:37Z",
  "acquisition_method": "HTTP_DOWNLOAD",
  "snapshot_manifest_path": "datasets/public/kb/manifests/2026-09-21/boss-plus-overdraft.manifest.json",
  "snapshot_hash": "sha256:74165910b9fc08ac639995c443895210b8845b0df8cb49ec4e00daee2f8af3c5"
}
