{
  "dataset_class": "PUBLIC_KB",
  "synthetic": false,
  "observation_id": "obs:small-business-credit:3aad2aab1ffa5171a5b39b1c3b806c6c",
  "collection_attempt_id": "collect:small-business-credit:eeb04e1b57885b4fbda9dc27ddf2facf",
  "collection_run_id": "run:c85c3aa2b2525055bb330533a7285ba8",
  "product_key": "small-business-credit",
  "source_url": "https://zloan.kbstar.com/quics?CooperCD=A000092&page=C106666",
  "final_url": null,
  "observed_at": "2026-09-22T14:00:36.524273Z",
  "acquisition_method": "HTTP_DOWNLOAD",
  "snapshot_manifest_path": "datasets/public/kb/manifests/2026-09-22/small-business-credit--08d48f15e16d98ce8db9e6d399defd12cbb47bc673243666f34bc386cb701c90.manifest.json",
  "snapshot_hash": "sha256:08d48f15e16d98ce8db9e6d399defd12cbb47bc673243666f34bc386cb701c90"
}
